{
  "recordId": "HDIP-CLA-A9-08-INTERACTION_CONTRACT_DECLARATION",
  "version": "0.1",
  "scope": "Illustrative Outcome / Value Feedback into Product Evolution; non-normative and NOT_ASSESSED",
  "sourceAuthority": "HDIP-CLA-0.1-M17",
  "interactionId": "HDIP-M12-INT-20",
  "interactionContractVersion": "0.1",
  "producerPlaneRefs": [
    "HDIP-P1"
  ],
  "consumerPlaneRefs": [
    "HDIP-P2"
  ],
  "logicalContractNotTechnologyBinding": true,
  "governingContextRefs": [
    "Illustrative governing context; source and target planes require per-interaction review"
  ]
}
